{
  "schema_version": "1.0",
  "approval": {
    "status": "APPROVED",
    "approver_id": "mwiza",
    "change_reason": "Wave 3 implementation: Create execution_records table with interpretation_version_id FK to bind executions to interpretation packs",
    "approved_at_utc": "2026-04-17T20:25:00Z",
    "role_authority": "Human Approver"
  },
  "ai": {
    "ai_used": true,
    "ai_prompt_hash": "6c588ba0f1458ae57f8d5efa351bb12d2d104da720b6c0d7cf98bc1c248ab2d5",
    "model_id": "claude-sonnet",
    "client": "cursor_codex",
    "session_id": "wave3-execution-records-implementation"
  },
  "scope": {
    "regulated_surfaces_touched": true,
    "paths_changed": [
      "schema/migrations/0118_create_execution_records.sql",
      "schema/migrations/MIGRATION_HEAD",
      "evidence/phase2/tsk_p2_preauth_003_01.json",
      "evidence/phase2/tsk_p2_preauth_003_02.json",
      "docs/invariants/exceptions/exception_change-rule_ddl_2026-04-17_3.md",
      "docs/architecture/THREAT_MODEL.md",
      "docs/architecture/COMPLIANCE_MAP.md"
    ],
    "invariants": [
      "INV-030"
    ],
    "phase_boundary_ok": true
  },
  "verification": {
    "commands": [
      "bash scripts/db/verify_tsk_p2_preauth_003_01.sh",
      "bash scripts/db/verify_tsk_p2_preauth_003_02.sh",
      "scripts/dev/pre_ci.sh"
    ],
    "pre_ci_passed": true,
    "notes": "Wave 3 Phase 2 implementation for TSK-P2-PREAUTH-003-00/01/02. Covers execution_records table creation and interpretation_version_id FK addition."
  }
}
