{
  "schema_version": "1.0",
  "approval": {
    "status": "APPROVED",
    "approver_id": "governance-human-reviewer",
    "change_reason": "Move demo deployment work off the published Wave-E branch onto feat/demo-deployment-repair, restore canonical TSK-P1-DEMO-024..028 on the repaired branch, rehome the provisioning sample-pack task to TSK-P1-DEMO-029, add the follow-on remediation task pack TSK-P1-206..210, and implement the approved security and traceability fixes in supervisor_api, Program.cs, index.html, and their verifier surfaces.",
    "approved_at_utc": "2026-03-14T18:10:00Z",
    "role_authority": "Human Approver"
  },
  "ai": {
    "ai_used": true,
    "ai_prompt_hash": "feat-demo-deployment-repair-task-line-repair",
    "model_id": "gpt-5-codex",
    "client": "codex_cli",
    "session_id": "feat-demo-deployment-repair-task-line-repair"
  },
  "scope": {
    "regulated_surfaces_touched": true,
    "paths_changed": [
      "approvals/2026-03-14/BRANCH-feat-demo-deployment-repair.approval.json",
      "approvals/2026-03-14/BRANCH-feat-demo-deployment-repair.md",
      "docs/audits/GIT_MUTATION_SURFACE_AUDIT_2026-03-10.md",
      "docs/operations/GREENTECH4CE_TENANT_PROGRAMME_PROVISIONING_RUNBOOK.md",
      "docs/operations/PHASE1_DEMO_DEPLOY_AND_TEST_CHECKLIST.md",
      "docs/operations/SYMPHONY_DEMO_E2E_RUNBOOK.md",
      "docs/operations/SYMPHONY_DEMO_START_NOW_CHECKLIST.md",
      "docs/operations/SYMPHONY_DEMO_DEPLOYMENT_GUIDE.md",
      "docs/security/SYMPHONY_DEMO_KEY_AND_ROTATION_POLICY.md",
      "docs/plans/phase1/TSK-P1-DEMO-029/PLAN.md",
      "docs/plans/phase1/TSK-P1-DEMO-029/EXEC_LOG.md",
      "docs/plans/phase1/TSK-P1-DEMO-030/PLAN.md",
      "docs/plans/phase1/TSK-P1-DEMO-030/EXEC_LOG.md",
      "docs/tasks/PHASE1_GOVERNANCE_TASKS.md",
      "evidence/phase1/approval_metadata.json",
      "scripts/audit/verify_tsk_p1_demo_030.sh",
      "scripts/audit/verify_tsk_p1_221.sh",
      "scripts/dev/pre_ci_demo.sh",
      "services/ledger-api/dotnet/src/LedgerApi/Program.cs",
      "tasks/TSK-P1-DEMO-029/meta.yml",
      "tasks/TSK-P1-DEMO-030/meta.yml"
    ],
    "invariants": [
      "INV-105",
      "INV-119",
      "INV-133"
    ],
    "phase_boundary_ok": true
  },
  "verification": {
    "commands": [
      "bash scripts/audit/verify_task_meta_schema.sh --mode strict --allow-legacy",
      "bash scripts/audit/verify_task_pack_readiness.sh --task TSK-P1-DEMO-029 --task TSK-P1-DEMO-030 --task TSK-P1-206 --task TSK-P1-207 --task TSK-P1-208 --task TSK-P1-209 --task TSK-P1-210",
      "bash scripts/audit/verify_agent_conformance.sh",
      "bash scripts/dev/pre_ci.sh"
    ],
    "pre_ci_passed": true,
    "notes": "Verified post-implementation pre_ci rerun for TSK-P1-206..210 implementation batch."
  }
}
